{
  "$schema": "../module-manifest.schema.json",
  "schemaVersion": 2,
  "designSystemVersion": "1.0.0",
  "moduleId": "foundation-shell",
  "routes": [
    "/bi/contratistas",
    "/bi/control-tower",
    "/bi/curva-s",
    "/bi/intermedia",
    "/bi/pdc",
    "/bi/programa-general",
    "/bi/responsables",
    "/bi/semanal",
    "/control-cambios",
    "/indicadores",
    "/profesionales",
    "/programa-general",
    "/programa-general-actualizar",
    "/programacion-intermedia",
    "/programacion-semanal",
    "/programacion-semanal/cic",
    "/programacion-semanal/cnc",
    "/programacion-semanal/cnp",
    "/subcontratistas"
  ],
  "sources": [
    "public/css/design-system/components/navigation.css",
    "public/css/design-system/adapters/shell-sidebar.css",
    "public/js/modules/aia_ui/sidebar_navigation.js",
    "public/js/modules/aia_ui/shell_week_admin.js"
  ],
  "components": [
    "shell",
    "button",
    "navigation",
    "state",
    "feedback"
  ],
  "vendors": [
    "bootstrap",
    "jquery",
    "font-awesome",
    "aia-fonts"
  ],
  "layouts": [
    "desktop"
  ],
  "states": [
    "normal",
    "focus"
  ],
  "roles": [
    "authenticated-project-member"
  ],
  "persistence": {
    "sidebar": "collapsed/expanded state in localStorage (aia-sidebar-state)"
  },
  "exceptions": [],
  "tests": [
    "tests/test_foundation_shell_contract.mjs",
    "tests/design-system/shell-navigation.test.mjs",
    "tests/test_shell_sidebar_partial.php",
    "tests/browser/shell-week-admin.mjs"
  ],
  "evidence": [],
  "scenarios": []
}
